Risk ID,Gap ID,Profile Name,Risk Description,Likelihood,Consequence,Regulatory Reference,Max Penalty,Risk Rating,Recommended Action
RSK-001,GAP-001,Weekend Hobbyist,Flying unregistered drone — enforcement action and fine,Medium,Medium,CAR 901.01,"$3,000",Medium,Register immediately at tc.canada.ca
RSK-002,GAP-002,Weekend Hobbyist,Flying without pilot certificate — enforcement fine and grounds for confiscation,Medium,High,CAR 901.05,"$3,000",High,Complete Basic Operations exam before next flight
RSK-003,GAP-003,Weekend Hobbyist,Unauthorized flight in controlled airspace near Billy Bishop Airport — serious enforcement risk,High,Critical,CAR 601.01,"$25,000 and potential criminal charges",Critical,Check NAV CANADA airspace map before every flight — non-negotiable
RSK-004,GAP-005,Weekend Hobbyist,Night operations without required lighting — collision risk and enforcement fine,Medium,High,CAR 901.25,"$3,000",High,Stop all night operations immediately until compliant lighting is installed
RSK-005,GAP-006,Commercial Photography Business,Commercial operations near people with wrong certificate level — fine and potential business shutdown,High,High,CAR 901.64,"$5,000 for corporations",Critical,Obtain Advanced certificate within 30 days — do not fly near bystanders until then
RSK-006,GAP-007,Commercial Photography Business,Flying within 30m of bystanders with only Basic certificate — immediate enforcement risk on every job,High,High,CAR 901.64,"$5,000",Critical,Restrict all commercial jobs to locations where 30m bystander clearance is achievable until Advanced certificate obtained
RSK-007,GAP-008,Drone Delivery Pilot Program,BVLOS operations without SFOC — most serious regulatory gap. Puts the entire operation at risk of shutdown and exposes company to criminal liability in the event of an incident,High,Critical,CAR 901.70,"$25,000 and potential criminal charges",Critical,Halt all BVLOS delivery routes immediately. Apply for SFOC before resuming. Engage a regulatory consultant to prepare the application.
RSK-008,GAP-009,Drone Delivery Pilot Program,Potential altitude exceedances on delivery routes — creates airspace conflict risk with manned aircraft,Medium,Critical,CAR 901.24,"$25,000",High,Conduct formal altitude audit of all routes. Implement hard altitude ceiling in flight control software.
